{
  "schema_version": 1,
  "id": "aaaaaaaa-aaaa-4aaa-8aaa-aaaaaaaaaaaa",
  "epoch": 1,
  "state": "DRAFT",
  "master_profile_id": "11111111-1111-4111-8111-111111111111",
  "follower_profile_ids": [
    "22222222-2222-4222-8222-222222222222",
    "33333333-3333-4333-8333-333333333333"
  ],
  "logical_tab_id": "main",
  "mode": "dom",
  "failure_policy": "strict",
  "allowed_origins": [
    "https://fixture.example"
  ],
  "queue_capacity": 200,
  "queue_max_age_ms": 2000,
  "fixed_stagger_ms": 0,
  "config_revision": 1
}
